;ncbi_gene_ID;HGNC;name;summary;ensembl_gene_id;refseq_accession;uniprot_ids;omim_id;orphanet;mane_select;gene_ID
39;4204;MECP2;methyl-CpG binding protein 2;DNA methylation is the major modification of eukaryotic genomes and plays an essential role in mammalian development. Human proteins MECP2, MBD1, MBD2, MBD3, and MBD4 comprise a family of nuclear proteins related by the presence in each of a methyl-CpG binding domain (MBD). Each of these proteins, with the exception of MBD3, is capable of binding specifically to methylated DNA. MECP2, MBD1 and MBD2 can also repress transcription from methylated gene promoters. In contrast to other MBD family members, MECP2 is X-linked and subject to X inactivation. MECP2 is dispensible in stem cells, but is essential for embryonic development. MECP2 gene mutations are the cause of most cases of Rett syndrome, a progressive neurologic developmental disorder and one of the most common causes of cognitive disability in females. Alternative splicing results in multiple transcript variants encoding different isoforms. [provided by RefSeq, Oct 2015];ENSG00000169057;NM_004992;P51608;300005;123186.0;ENST00000453960.7|NM_001110792.2;gene_ID_39
40;9968;MED12;mediator complex subunit 12;The initiation of transcription is controlled in part by a large protein assembly known as the preinitiation complex. A component of this preinitiation complex is a 1.2 MDa protein aggregate called Mediator. This Mediator component binds with a CDK8 subcomplex which contains the protein encoded by this gene, mediator complex subunit 12 (MED12), along with MED13, CDK8 kinase, and cyclin C. The CDK8 subcomplex modulates Mediator-polymerase II interactions and thereby regulates transcription initiation and reinitation rates. The MED12 protein is essential for activating CDK8 kinase. Defects in this gene cause X-linked Opitz-Kaveggia syndrome, also known as FG syndrome, and Lujan-Fryns syndrome. [provided by RefSeq, Aug 2009];ENSG00000184634;NM_005120;Q93074;300188;138486.0;ENST00000374080.8|NM_005120.3;gene_ID_40
41;4593;MUSK;muscle associated receptor tyrosine kinase;This gene encodes a muscle-specific tyrosine kinase receptor. The encoded protein may play a role in clustering of the acetylcholine receptor in the postsynaptic neuromuscular junction. Mutations in this gene have been associated with congenital myasthenic syndrome. Alternatively spliced transcript variants have been described.[provided by RefSeq, Oct 2009];ENSG00000030304;NM_001166280;O15146;601296;160311.0;ENST00000374448.9|NM_005592.4;gene_ID_41
42;128240;NAXE;NAD(P)HX epimerase;The product of this gene interacts with apolipoprotein A-I (apoA-I), the major apolipoprotein of high-density lipoproteins (HDLs). It is secreted into some bodily fluids, and its synthesis and secretion are stimulated in vitro by incubating cells with apoA-I. The human genome contains related pseudogenes. [provided by RefSeq, Jul 2008];ENSG00000163382;NM_144772;Q8NCW5;608862;;ENST00000368235.8|NM_144772.3;gene_ID_42
43;200030;NBPF11;NBPF member 11;Predicted to be located in cytoplasm. [provided by Alliance of Genome Resources, Jul 2025];ENSG00000263956;NM_183372;Q86T75;614001;;ENST00000682118.1|NM_001385469.3;gene_ID_43
44;100288142;NBPF20;NBPF member 20;This gene is a member of the neuroblastoma breakpoint family (NBPF) which consists of dozens of recently duplicated genes primarily located in segmental duplications on human chromosome 1. This gene family has experienced its greatest expansion within the human lineage and has expanded, to a lesser extent, among primates in general. Members of this gene family are characterized by tandemly repeated copies of DUF1220 protein domains. Gene copy number variations in the human chromosomal region 1q21.1, where most DUF1220 domains are located, have been implicated in a number of developmental and neurogenetic diseases such as microcephaly, macrocephaly, autism, schizophrenia, cognitive disability, congenital heart disease, neuroblastoma, and congenital kidney and urinary tract anomalies. Altered expression of some gene family members is associated with several types of cancer. This gene family contains numerous pseudogenes. [provided by RefSeq, Mar 2014];ENSG00000162825;NM_001278267;P0DPF2;614007;;ENST00000698833.1|NM_001397211.1;gene_ID_44
45;54820;NDE1;nudE neurodevelopment protein 1;This gene encodes a member of the nuclear distribution E (NudE) family of proteins. The encoded protein is localized at the centrosome and interacts with other centrosome components as part of a multiprotein complex that regulates dynein function. This protein plays an essential role in microtubule organization, mitosis and neuronal migration. Mutations in this gene cause lissencephaly 4, a disorder characterized by lissencephaly, severe brain atrophy, microcephaly, and severe cognitive disability. Alternative splicing results in multiple transcript variants. [provided by RefSeq, Mar 2012];ENSG00000072864;NM_017668;Q9NXR1;609449;281616.0;ENST00000396354.6|NM_017668.3;gene_ID_45
46;4695;NDUFA2;NADH:ubiquinone oxidoreductase subunit A2;The encoded protein is a subunit of the hydrophobic protein fraction of the NADH:ubiquinone oxidoreductase (complex 1), the first enzyme complex in the electron transport chain located in the inner mitochondrial membrane, and may be involved in regulating complex I activity or its assembly via assistance in redox processes. Mutations in this gene are associated with Leigh syndrome, an early-onset progressive neurodegenerative disorder. Alternative splicing results in multiple transcript variants.[provided by RefSeq, May 2010];ENSG00000131495;NM_002488;O43678;602137;252455.0;ENST00000252102.9|NM_002488.5;gene_ID_46
47;401115;NICOL1;NELL2 interacting cell ontogeny regulator 1;Predicted to enable mRNA 3'-UTR binding activity. Predicted to be involved in 3'-UTR-mediated mRNA stabilization and spermatogenesis. Predicted to be located in perinuclear region of cytoplasm. Predicted to be active in extracellular space. [provided by Alliance of Genome Resources, Jul 2025];ENSG00000243449;NM_001141936;Q5BLP8;614690;;ENST00000409248.10|NM_001168243.4;gene_ID_47
48;123606;NIPA1;NIPA magnesium transporter 1;This gene encodes a magnesium transporter that associates with early endosomes and the cell surface in a variety of neuronal and epithelial cells. This protein may play a role in nervous system development and maintenance. Multiple transcript variants encoding different isoforms have been found for this gene. Mutations in this gene have been associated with autosomal dominant spastic paraplegia 6. [provided by RefSeq, Nov 2008];ENSG00000170113;NM_144599;Q7RTP0;608145;123785.0;ENST00000337435.9|NM_144599.5;gene_ID_48
49;50814;NSDHL;NAD(P) dependent 3-beta-hydroxysteroid dehydrogenase NSDHL;The protein encoded by this gene is localized in the endoplasmic reticulum and is involved in cholesterol biosynthesis. Mutations in this gene are associated with CHILD syndrome, which is a X-linked dominant disorder of lipid metabolism with disturbed cholesterol biosynthesis, and typically lethal in males. Alternatively spliced transcript variants with differing 5' UTR have been found for this gene. [provided by RefSeq, Jul 2008];ENSG00000147383;NM_015922;Q15738;300275;123942.0;ENST00000370274.8|NM_015922.3;gene_ID_49
50;4983;OPHN1;oligophrenin 1;This gene encodes a Rho-GTPase-activating protein that promotes GTP hydrolysis of Rho subfamily members. Rho proteins are important mediators of intracellular signal transduction, which affects cell migration and cell morphogenesis. Mutations in this gene are responsible for OPHN1-related X-linked cognitive disability with cerebellar hypoplasia and distinctive facial dysmorhphism. [provided by RefSeq, Jul 2008];ENSG00000079482;NM_002547;O60890;300127;159936.0;ENST00000355520.6|NM_002547.3;gene_ID_50
51;7849;PAX8;paired box 8;This gene encodes a member of the paired box (PAX) family of transcription factors. Members of this gene family typically encode proteins that contain a paired box domain, an octapeptide, and a paired-type homeodomain. This nuclear protein is involved in thyroid follicular cell development and expression of thyroid-specific genes. Mutations in this gene have been associated with thyroid dysgenesis, thyroid follicular carcinomas and atypical follicular thyroid adenomas. Alternatively spliced transcript variants encoding different isoforms have been described. [provided by RefSeq, Mar 2010];ENSG00000125618;NM_003466;Q06710;167415;124103.0;ENST00000429538.8|NM_003466.4;gene_ID_51
52;5130;PCYT1A;phosphate cytidylyltransferase 1A, choline;This gene belongs to the cytidylyltransferase family and is involved in the regulation of phosphatidylcholine biosynthesis. Mutations in this gene are associated with spondylometaphyseal dysplasia with cone-rod dystrophy. Alternatively spliced transcript variants have been found for this gene. [provided by RefSeq, Aug 2015];ENSG00000161217;NM_005017;P49585;123695;391468.0;ENST00000431016.6|NM_001312673.2;gene_ID_52
53;8799;PEX11B;peroxisomal biogenesis factor 11 beta;The protein encoded by this gene facilitates peroxisomal proliferation and interacts with PEX19. The encoded protein is found in the peroxisomal membrane. Several transcript variants, some protein-coding and some not protein-coding, have been found for this gene. [provided by RefSeq, Dec 2012];ENSG00000131779;NM_003846;O96011;603867;317370.0;ENST00000369306.8|NM_003846.3;gene_ID_53
54;55670;PEX26;peroxisomal biogenesis factor 26;This gene belongs to the peroxin-26 gene family. It is probably required for protein import into peroxisomes. It anchors PEX1 and PEX6 to peroxisome membranes, possibly to form heteromeric AAA ATPase complexes required for the import of proteins into peroxisomes. Defects in this gene are the cause of peroxisome biogenesis disorder complementation group 8 (PBD-CG8). PBD refers to a group of peroxisomal disorders arising from a failure of protein import into the peroxisomal membrane or matrix. The PBD group is comprised of four disorders: Zellweger syndrome (ZWS), neonatal adrenoleukodystrophy (NALD), infantile Refsum disease (IRD), and classical rhizomelic chondrodysplasia punctata (RCDP). Alternatively spliced transcript variants have been identified for this gene. [provided by RefSeq, Dec 2010];ENSG00000215193;NM_017929;Q7Z412;608666;124206.0;ENST00000399744.8|NM_001127649.3;gene_ID_54
55;5277;PIGA;phosphatidylinositol glycan anchor biosynthesis class A;This gene encodes a protein required for synthesis of N-acetylglucosaminyl phosphatidylinositol (GlcNAc-PI), the first intermediate in the biosynthetic pathway of GPI anchor. The GPI anchor is a glycolipid found on many blood cells and which serves to anchor proteins to the cell surface. Paroxysmal nocturnal hemoglobinuria, an acquired hematologic disorder, has been shown to result from mutations in this gene. Alternate splice variants have been characterized. A related pseudogene is located on chromosome 12. [provided by RefSeq, Jun 2010];ENSG00000165195;NM_002641;P37287;311770;231527.0;ENST00000333590.6|NM_002641.4;gene_ID_55
56;5336;PLCG2;phospholipase C gamma 2;The protein encoded by this gene is a transmembrane signaling enzyme that catalyzes the conversion of 1-phosphatidyl-1D-myo-inositol 4,5-bisphosphate to 1D-myo-inositol 1,4,5-trisphosphate (IP3) and diacylglycerol (DAG) using calcium as a cofactor. IP3 and DAG are second messenger molecules important for transmitting signals from growth factor receptors and immune system receptors across the cell membrane. Mutations in this gene have been found in autoinflammation, antibody deficiency, and immune dysregulation syndrome and familial cold autoinflammatory syndrome 3. [provided by RefSeq, Mar 2014];ENSG00000197943;NM_001425749;P16885;600220;303819.0;ENST00000564138.6|NM_002661.5;gene_ID_56
57;8228;PNPLA4;patatin like domain 4, phospholipase and triacylglycerol lipase;This gene encodes a member of the patatin-like family of phospholipases. The encoded enzyme has both triacylglycerol lipase and transacylase activities and may be involved in adipocyte triglyceride homeostasis. Alternate splicing results in multiple transcript variants. A pseudogene of this gene is found on chromosome Y. [provided by RefSeq, Feb 2010];ENSG00000006757;NM_004650;P41247;300102;;ENST00000381042.9|NM_004650.3;gene_ID_57
58;112476;PRRT2;proline rich transmembrane protein 2;This gene encodes a transmembrane protein containing a proline-rich domain in its N-terminal half. Studies in mice suggest that it is predominantly expressed in brain and spinal cord in embryonic and postnatal stages. Mutations in this gene are associated with episodic kinesigenic dyskinesia-1. Alternatively spliced transcript variants encoding different isoforms have been found for this gene. [provided by RefSeq, Jan 2012];ENSG00000167371;NM_145239;Q7Z6L0;614386;291703.0;ENST00000358758.12|NM_145239.3;gene_ID_58
59;8226;PUDP;pseudouridine 5''-phosphatase;This gene encodes a member of the haloacid dehalogenase-like (HAD) hydrolase superfamily. The encoded protein has no known biological function. This gene has a pseudogene on chromosome 1. Multiple alternatively spliced transcript variants encoding different isoforms have been identified. [provided by RefSeq, Jul 2010];ENSG00000130021;NM_012080;Q08623;306480;;ENST00000381077.10|NM_012080.5;gene_ID_59
60;5903;RANBP2;RAN binding protein 2;RAN is a small GTP-binding protein of the RAS superfamily that is associated with the nuclear membrane and is thought to control a variety of cellular functions through its interactions with other proteins. This gene encodes a very large RAN-binding protein that immunolocalizes to the nuclear pore complex. The protein is a giant scaffold and mosaic cyclophilin-related nucleoporin implicated in the Ran-GTPase cycle. The encoded protein directly interacts with the E2 enzyme UBC9 and strongly enhances SUMO1 transfer from UBC9 to the SUMO1 target SP100. These findings place sumoylation at the cytoplasmic filaments of the nuclear pore complex and suggest that, for some substrates, modification and nuclear import are linked events. This gene is partially duplicated in a gene cluster that lies in a hot spot for recombination on chromosome 2q. [provided by RefSeq, Jul 2008];ENSG00000153201;NM_006267;P49792;601181;173526.0;ENST00000283195.11|NM_006267.5;gene_ID_60
61;91179;SCARF2;scavenger receptor class F member 2;The protein encoded by this gene is similar to  SCARF1/SREC-I, a scavenger receptor protein that mediates the binding and degradation of acetylated low density lipoprotein (Ac-LDL). This protein has only little activity of internalizing modified low density lipoproteins (LDL), but it can interact with SCARF1 through its extracellular domain. The association of this protein with SCARF1 is suppressed by the presence of scavenger ligands. Alternatively spliced transcript variants encoding distinct isoforms have been reported. [provided by RefSeq, Jul 2008];ENSG00000244486;NM_153334;Q96GP6;613619;244390.0;ENST00000622235.5|NM_182895.5;gene_ID_61
62;6389;SDHA;succinate dehydrogenase complex flavoprotein subunit A;This gene encodes a major catalytic subunit of succinate-ubiquinone oxidoreductase, a complex of the mitochondrial respiratory chain. The complex is composed of four nuclear-encoded subunits and is localized in the mitochondrial inner membrane. Mutations in this gene have been associated with a form of mitochondrial respiratory chain deficiency known as Leigh Syndrome. A pseudogene has been identified on chromosome 3q29. Alternatively spliced transcript variants encoding different isoforms have been found for this gene. [provided by RefSeq, Jun 2014];ENSG00000073578;NM_004168;P31040;600857;118549.0;ENST00000264932.11|NM_004168.4;gene_ID_62
63;25970;SH2B1;SH2B adaptor protein 1;This gene encodes a member of the SH2-domain containing mediators family. The encoded protein mediates activation of various kinases and may function in cytokine and growth factor receptor signaling and cellular transformation. Alternatively spliced transcript variants have been described. [provided by RefSeq, Mar 2009];ENSG00000178188;NM_015503;Q9NRF2;608937;293315.0;ENST00000684370.1|NM_001387430.1;gene_ID_63
64;6469;SHH;sonic hedgehog signaling molecule;"This gene encodes a protein that is instrumental in patterning the early embryo. It has been implicated as the key inductive signal in patterning of the ventral neural tube, the anterior-posterior limb axis, and the ventral somites. Of three human proteins showing sequence and functional similarity to the sonic hedgehog protein of Drosophila, this protein is the most similar. The protein is made as a precursor that is autocatalytically cleaved; the N-terminal portion is soluble and contains the signalling activity while the C-terminal portion is involved in precursor processing. More importantly, the C-terminal product covalently attaches a cholesterol moiety to the N-terminal product, restricting the N-terminal product to the cell surface and preventing it from freely diffusing throughout the developing embryo. Defects in this protein or in its signalling pathway are a cause of holoprosencephaly (HPE), a disorder in which the developing forebrain fails to correctly separate into right and left hemispheres. HPE is manifested by facial deformities. It is also thought that mutations in this gene or in its signalling pathway may be responsible for VACTERL syndrome, which is characterized by vertebral defects, anal atresia, tracheoesophageal fistula with esophageal atresia, radial and renal dysplasia, cardiac anomalies, and limb abnormalities. Additionally, mutations in a long range enhancer located approximately 1 megabase upstream of this gene disrupt limb patterning and can result in preaxial polydactyly. [provided by RefSeq, Jul 2008]";ENSG00000164690;NM_000193;Q15465;600725;118703.0;ENST00000297261.7|NM_000193.4;gene_ID_64
65;6473;SHOX;SHOX homeobox;This gene belongs to the paired homeobox family and is located in the pseudoautosomal region 1 (PAR1) of X and Y chromosomes. Defects in this gene are associated with idiopathic growth retardation and in the short stature phenotype of Turner syndrome patients. This gene is highly conserved across species from mammals to fish to flies. Alternatively spliced transcript variants encoding different isoforms have been noted for this gene. [provided by RefSeq, Jul 2008];ENSG00000185960;NM_000451;O15266;312865|400020;118707.0;ENST00000686671.1|NM_000451.4;gene_ID_65
66;6569;SLC34A1;solute carrier family 34 member 1;"Enables sodium:phosphate symporter activity. Involved in several processes, including phosphate ion homeostasis; response to cadmium ion; and response to lead ion. Located in several cellular components, including apical plasma membrane; mitotic spindle; and nuclear speck. Implicated in several diseases, including Fanconi syndrome (multiple); chronic kidney disease; hereditary hypophosphatemic rickets with hypercalciuria; hypophosphatemic nephrolithiasis/osteoporosis 1; and nephrolithiasis. [provided by Alliance of Genome Resources, Jul 2025]";ENSG00000131183;NM_003052;Q06495;182309;227390.0;ENST00000324417.6|NM_003052.5;gene_ID_66
67;7922;SLC39A7;solute carrier family 39 member 7;The protein encoded by this gene transports zinc from the Golgi and endoplasmic reticulum to the cytoplasm. This transport may be important for activation of tyrosine kinases, some of which could be involved in cancer progression. Therefore, modulation of the encoded protein could be useful as a therapeutic agent against cancer. Alternative splicing results in multiple transcript variants. [provided by RefSeq, Jan 2014];ENSG00000112473;NM_006979;Q92504;601416;;ENST00000374677.8|NM_006979.3;gene_ID_67
68;6521;SLC4A1;solute carrier family 4 member 1 (Diego blood group);The protein encoded by this gene is part of the anion exchanger (AE) family and is expressed in the erythrocyte plasma membrane, where it functions as a chloride/bicarbonate exchanger involved in carbon dioxide transport from tissues to lungs. The protein comprises two domains that are structurally and functionally distinct. The N-terminal 40kDa domain is located in the cytoplasm and acts as an attachment site for the red cell skeleton by binding ankyrin. The glycosylated C-terminal membrane-associated domain contains 12-14 membrane spanning segments and carries out the stilbene disulphonate-sensitive exchange transport of anions. The cytoplasmic tail at the extreme C-terminus of the membrane domain binds carbonic anhydrase II. The encoded protein associates with the red cell membrane protein glycophorin A and this association promotes the correct folding and translocation of the exchanger. This protein is predominantly dimeric but forms tetramers in the presence of ankyrin. Many mutations in this gene are known in man, and these mutations can lead to two types of disease: destabilization of red cell membrane leading to hereditary spherocytosis, and defective kidney acid secretion leading to distal renal tubular acidosis. Other mutations that do not give rise to disease result in novel blood group antigens, which form the Diego blood group system. Southeast Asian ovalocytosis (SAO, Melanesian ovalocytosis) results from the heterozygous presence of a deletion in the encoded protein and is common in areas where Plasmodium falciparum malaria is endemic. One null mutation in this gene is known, resulting in very severe anemia and nephrocalcinosis. [provided by RefSeq, Jul 2008];ENSG00000004939;NM_000342;P02730;109270;119669.0;ENST00000262418.12|NM_000342.4;gene_ID_68
69;6598;SMARCB1;SWI/SNF related BAF chromatin remodeling complex subunit B1;The protein encoded by this gene is part of a complex that relieves repressive chromatin structures, allowing the transcriptional machinery to access its targets more effectively. The encoded nuclear protein may also bind to and enhance the DNA joining activity of HIV-1 integrase. This gene has been found to be a tumor suppressor, and mutations in it have been associated with malignant rhabdoid tumors. Alternatively spliced transcript variants have been found for this gene. [provided by RefSeq, Dec 2015];ENSG00000099956;NM_003073;Q12824;601607;119735.0;ENST00000644036.2|NM_003073.5;gene_ID_69
70;23013;SPEN;spen family transcriptional repressor;"This gene encodes a hormone inducible transcriptional repressor. Repression of transcription by this gene product can occur through interactions with other repressors, by the recruitment of proteins involved in histone deacetylation, or through sequestration of transcriptional activators. The product of this gene contains a carboxy-terminal domain that permits binding to other corepressor proteins. This domain also permits interaction with members of the NuRD complex, a nucleosome remodeling protein complex that contains deacetylase activity. In addition, this repressor contains several RNA recognition motifs that confer binding to a steroid receptor RNA coactivator; this binding can modulate the activity of both liganded and nonliganded steroid receptors. [provided by RefSeq, Jul 2008]";ENSG00000065526;NM_015001;Q96T58;613484;;ENST00000375759.8|NM_015001.3;gene_ID_70
71;11005;SPINK5;serine peptidase inhibitor Kazal type 5;This gene encodes a multidomain serine protease inhibitor that contains 15 potential inhibitory domains. The encoded preproprotein is proteolytically processed to generate multiple protein products, which may exhibit unique activities and specificities. These proteins may play a role in skin and hair morphogenesis, as well as anti-inflammatory and antimicrobial protection of mucous epithelia. Mutations in this gene may result in Netherton syndrome, a disorder characterized by ichthyosis, defective cornification, and atopy. This gene is present in a gene cluster on chromosome 5. Alternative splicing results in multiple transcript variants. [provided by RefSeq, Oct 2015];ENSG00000133710;NM_001127698;Q9NQ38;605010;119840.0;ENST00000256084.8|NM_006846.4;gene_ID_71
72;8406;SRPX;sushi repeat containing protein X-linked;"Predicted to be an extracellular matrix structural constituent. Predicted to be involved in phagolysosome assembly. Predicted to act upstream of or within several processes, including negative regulation of cell proliferation involved in contact inhibition; positive regulation of extrinsic apoptotic signaling pathway in absence of ligand; and response to endoplasmic reticulum stress. Located in collagen-containing extracellular matrix. [provided by Alliance of Genome Resources, Apr 2025]";ENSG00000101955;NM_006307;P78539;300187;471150.0;ENST00000378533.4|NM_006307.5;gene_ID_72
73;6777;STAT5B;signal transducer and activator of transcription 5B;The protein encoded by this gene is a member of the STAT family of transcription factors. In response to cytokines and growth factors, STAT family members are phosphorylated by the receptor associated kinases, and then form homo- or heterodimers that translocate to the cell nucleus where they act as transcription activators. This protein mediates the signal transduction triggered by various cell ligands, such as IL2, IL4, CSF1, and different growth hormones. It has been shown to be involved in diverse biological processes, such as TCR signaling, apoptosis, adult mammary gland development, and sexual dimorphism of liver gene expression. This gene was found to fuse to retinoic acid receptor-alpha (RARA) gene in a small subset of acute promyelocytic leukemias (APLL). The dysregulation of the signaling pathways mediated by this protein may be the cause of the APLL. [provided by RefSeq, Jul 2008];ENSG00000173757;NM_012448;P51692;604260;119882.0;ENST00000293328.8|NM_012448.4;gene_ID_73
