;ncbi_gene_ID;HGNC;name;summary;ensembl_gene_id;refseq_accession;uniprot_ids;omim_id;orphanet;mane_select;gene_ID
0;4363;ABCC1;ATP binding cassette subfamily C member 1 (ABCC1 blood group);The protein encoded by this gene is a member of the superfamily of ATP-binding cassette (ABC) transporters. ABC proteins transport various molecules across extra-and intra-cellular membranes. ABC genes are divided into seven distinct subfamilies (ABC1, MDR/TAP, MRP, ALD, OABP, GCN20, White). This full transporter is a member of the MRP subfamily which is involved in multi-drug resistance. This protein functions as a multispecific organic anion transporter, with oxidized glutatione, cysteinyl leukotrienes, and activated aflatoxin B1 as substrates. This protein also transports glucuronides and sulfate conjugates of steroid hormones and bile salts. Alternatively spliced variants of this gene have been described but their full-length nature is unknown. [provided by RefSeq, Apr 2012];ENSG00000103222;NM_004996;P33527;158343;469890.0;ENST00000399410.8|NM_004996.4;gene_ID_0
1;104;ADARB1;adenosine deaminase RNA specific B1;This gene encodes the enzyme responsible for pre-mRNA editing of the glutamate receptor subunit B by site-specific deamination of adenosines. Studies in rat found that this enzyme acted on its own pre-mRNA molecules to convert an AA dinucleotide to an AI dinucleotide which resulted in a new splice site. Alternative splicing of this gene results in several transcript variants, some of which have been characterized by the presence or absence of an ALU cassette insert and a short or long C-terminal region. [provided by RefSeq, Jul 2008];ENSG00000197381;NM_015833;P78563;601218;;ENST00000348831.9|NM_001112.4;gene_ID_1
2;3730;ANOS1;anosmin 1;Mutations in this gene cause the X-linked Kallmann syndrome. The encoded protein is similar in sequence to proteins known to function in neural cell adhesion and axonal migration. In addition, this cell surface protein is N-glycosylated and may have anti-protease activity. [provided by RefSeq, Jul 2008];ENSG00000011201;NM_000216;P23352;300836;122751.0;ENST00000262648.8|NM_000216.4;gene_ID_2
3;54880;BCOR;BCL6 corepressor;The protein encoded by this gene was identified as an interacting corepressor of BCL6, a POZ/zinc finger transcription repressor that is required for germinal center formation and may influence apoptosis. This protein selectively interacts with the POZ domain of BCL6, but not with eight other POZ proteins. Specific class I and II histone deacetylases (HDACs) have been shown to interact with this protein, which suggests a possible link between the two classes of HDACs. Several transcript variants encoding different isoforms have been found for this gene. A pseudogene of this gene is found on chromosome Y.[provided by RefSeq, Jun 2010];ENSG00000183337;NM_017745;Q6W2J9;300485;119012.0;ENST00000378444.9|NM_001123385.2;gene_ID_3
4;8913;CACNA1G;calcium voltage-gated channel subunit alpha1 G;Voltage-sensitive calcium channels mediate the entry of calcium ions into excitable cells, and are also involved in a variety of calcium-dependent processes, including muscle contraction, hormone or neurotransmitter release, gene expression, cell motility, cell division, and cell death. This gene encodes a T-type, low-voltage activated calcium channel. The T-type channels generate currents that are both transient, owing to fast inactivation, and tiny, owing to small conductance. T-type channels are thought to be involved in pacemaker activity, low-threshold calcium spikes, neuronal oscillations and resonance, and rebound burst firing. Many alternatively spliced transcript variants encoding different isoforms have been described for this gene. [provided by RefSeq, Sep 2011];ENSG00000006283;NM_018896;O43497;604065;460876.0;ENST00000359106.10|NM_018896.5;gene_ID_4
5;998;CDC42;cell division cycle 42;The protein encoded by this gene is a small GTPase of the Rho-subfamily, which regulates signaling pathways that control diverse cellular functions including cell morphology, migration, endocytosis and cell cycle progression. This protein is highly similar to Saccharomyces cerevisiae Cdc 42, and is able to complement the yeast cdc42-1 mutant. The product of oncogene Dbl was reported to specifically catalyze the dissociation of GDP from this protein. This protein could regulate actin polymerization through its direct binding to Neural Wiskott-Aldrich syndrome protein (N-WASP), which subsequently activates Arp2/3 complex. Alternative splicing of this gene results in multiple transcript variants. Pseudogenes of this gene have been identified on chromosomes 3, 4, 5, 7, 8 and 20. [provided by RefSeq, Apr 2013];ENSG00000070831;NM_001791;P60953;116952;470056.0;ENST00000656825.1|NM_001791.4;gene_ID_5
6;1185;CLCN6;chloride voltage-gated channel 6;This gene encodes a member of the voltage-dependent chloride channel protein family. Members of this family can function as either chloride channels or antiporters. This protein is primarily localized to late endosomes and functions as a chloride/proton antiporter. Alternate splicing results in both coding and non-coding variants. Additional alternately spliced variants have been described but their full-length structure is unknown. [provided by RefSeq, Mar 2012];ENSG00000011021;NM_001286;P51797;602726;;ENST00000346436.11|NM_001286.5;gene_ID_6
7;4849;CNOT3;CCR4-NOT transcription complex subunit 3;Involved in regulation of stem cell population maintenance. Part of CCR4-NOT complex. [provided by Alliance of Genome Resources, Jul 2025];ENSG00000088038;NM_014516;O75175;604910;352239.0;ENST00000221232.11|NM_014516.4;gene_ID_7
8;1340;COX6B1;cytochrome c oxidase subunit 6B1;Cytochrome c oxidase (COX), the terminal enzyme of the mitochondrial respiratory chain, catalyzes the electron transfer from reduced cytochrome c to oxygen. It is a heteromeric complex consisting of 3 catalytic subunits encoded by mitochondrial genes and multiple structural subunits encoded by nuclear genes. The mitochondrially-encoded subunits function in electron transfer, and the nuclear-encoded subunits may be involved in the regulation and assembly of the complex. This nuclear gene encodes subunit VIb. Mutations in this gene are associated with severe infantile encephalomyopathy. Three pseudogenes COX6BP-1, COX6BP-2 and COX6BP-3 have been found on chromosomes 7, 17 and 22q13.1-13.2, respectively. [provided by RefSeq, Jan 2010];ENSG00000126267;NM_001863;P14854;124089;167892.0;ENST00000649813.2|NM_001863.5;gene_ID_8
9;10815;CPLX1;complexin 1;Proteins encoded by the complexin/synaphin gene family are cytosolic proteins that function in synaptic vesicle exocytosis.  These proteins bind syntaxin, part of the SNAP receptor.  The protein product of this gene binds to the SNAP receptor complex and disrupts it, allowing transmitter release. [provided by RefSeq, Jul 2008];ENSG00000168993;NM_006651;O14810;605032;;ENST00000304062.11|NM_006651.4;gene_ID_9
10;64109;CRLF2;cytokine receptor like factor 2;This gene encodes a member of the type I cytokine receptor family. The encoded protein is a receptor for thymic stromal lymphopoietin (TSLP). Together with the interleukin 7 receptor (IL7R), the encoded protein and TSLP activate STAT3, STAT5, and JAK2 pathways, which control processes such as cell proliferation and development of the hematopoietic system. Rearrangement of this gene with immunoglobulin heavy chain gene (IGH) on chromosome 14, or with P2Y purinoceptor 8 gene (P2RY8) on the same X or Y chromosomes is associated with B-progenitor acute lymphoblastic leukemia (ALL) and Down syndrome ALL. Alternatively spliced transcript variants have been found for this gene. [provided by RefSeq, Sep 2014];ENSG00000205755;NM_022148;Q9HC73;300357|400023;;ENST00000400841.8|NM_022148.4;gene_ID_10
11;23259;DDHD2;DDHD domain containing 2;This gene encodes a phospholipase enzyme containing sterile-alpha-motif (SAM), WWE, and DDHD domains. This protein participates in membrane trafficking between the endoplastic reticulum and the Golgi body. Mutations in this gene can cause autosomal recessive spastic paraplegia 54. Alternative splicing results in multiple transcript variants. [provided by RefSeq, Dec 2013];ENSG00000085788;NM_015214;O94830;615003;321575.0;ENST00000397166.7|NM_015214.3;gene_ID_11
12;85359;DGCR6L;DiGeorge syndrome critical region gene 6 like;This gene, the result of a duplication at this locus, is one of two functional genes encoding nearly identical proteins that have similar expression patterns. The product of this gene is a protein that shares homology with the Drosophila gonadal protein, expressed in gonadal tissues and germ cells, and with the human laminin gamma-1 chain that functions in cell attachment and migration. This gene is located in a region of chromosome 22 implicated in the DiGeorge syndrome, one facet of a broader collection of anomalies referred to as the CATCH 22 syndrome. [provided by RefSeq, Jul 2008];ENSG00000128185;NM_033257;Q9BY27;609459;;ENST00000248879.8|NM_033257.4;gene_ID_12
13;1896;EDA;ectodysplasin A;The protein encoded by this gene is a type II membrane protein that can be cleaved by furin to produce a secreted form. The encoded protein, which belongs to the tumor necrosis factor family, acts as a homotrimer and may be involved in cell-cell signaling during the development of ectodermal organs. Defects in this gene are a cause of ectodermal dysplasia, anhidrotic, which is also known as X-linked hypohidrotic ectodermal dysplasia. Several transcript variants encoding many different isoforms have been found for this gene. [provided by RefSeq, Jul 2008];ENSG00000158813;NM_001399;Q92838;300451;121263.0;ENST00000374552.9|NM_001399.5;gene_ID_13
14;1910;EDNRB;endothelin receptor type B;The protein encoded by this gene is a G protein-coupled receptor which activates a phosphatidylinositol-calcium second messenger system. Its ligand, endothelin, consists of a family of three potent vasoactive peptides: ET1, ET2, and ET3. Studies suggest that the multigenic disorder, Hirschsprung disease type 2, is due to mutations in the endothelin receptor type B gene. Alternative splicing and the use of alternative promoters results in multiple transcript variants. [provided by RefSeq, Oct 2016];ENSG00000136160;NM_000115;P24530;131244;121287.0;ENST00000646607.2|NM_001122659.3;gene_ID_14
15;79813;EHMT1;euchromatic histone lysine methyltransferase 1;The protein encoded by this gene is a histone methyltransferase that methylates the lysine-9 position of histone H3. This action marks the genomic region packaged with these methylated histones for transcriptional repression. This protein may be involved in the silencing of MYC- and E2F-responsive genes and therefore could play a role in the G0/G1 cell cycle transition. Defects in this gene are a cause of chromosome 9q subtelomeric deletion syndrome (9q-syndrome, also known as Kleefstra syndrome). Alternative splicing results in multiple transcript variants. [provided by RefSeq, Aug 2017];ENSG00000181090;NM_024757;Q9H9B1;607001;226051.0;ENST00000460843.6|NM_024757.5;gene_ID_15
16;2177;FANCD2;FA complementation group D2;"The Fanconi anemia complementation group (FANC) currently includes FANCA, FANCB, FANCC, FANCD1 (also called BRCA2), FANCD2, FANCE, FANCF, FANCG, FANCI, FANCJ (also called BRIP1), FANCL, FANCM and FANCN (also called PALB2). The previously defined group FANCH is the same as FANCA. Fanconi anemia is a genetically heterogeneous recessive disorder characterized by cytogenetic instability, hypersensitivity to DNA crosslinking agents, increased chromosomal breakage, and defective DNA repair. The members of the Fanconi anemia complementation group do not share sequence similarity; they are related by their assembly into a common nuclear protein complex. This gene encodes the protein for complementation group D2. This protein is monoubiquinated in response to DNA damage, resulting in its localization to nuclear foci with other proteins (BRCA1 AND BRCA2) involved in homology-directed DNA repair. Alternative splicing results in multiple transcript variants. [provided by RefSeq, Feb 2016]";ENSG00000144554;NM_001018115;Q9BXW9;613984;121709.0;ENST00000675286.1|NM_001018115.3;gene_ID_16
17;23291;FBXW11;F-box and WD repeat domain containing 11;This gene encodes a member of the F-box protein family which is characterized by an approximately 40 amino acid motif, the F-box. The F-box proteins constitute one of the four subunits of ubiquitin protein ligase complex called SCFs (SKP1-cullin-F-box), which function in phosphorylation-dependent ubiquitination. The F-box proteins are divided into 3 classes: Fbws containing WD-40 domains, Fbls containing leucine-rich repeats, and Fbxs containing either different protein-protein interaction modules or no recognizable motifs. The protein encoded by this gene belongs to the Fbws class and, in addition to an F-box, contains multiple WD40 repeats. This gene contains at least 14 exons, and its alternative splicing generates 3 transcript variants diverging at the presence/absence of two alternate exons. [provided by RefSeq, Jul 2008];ENSG00000072803;NM_012300;Q9UKB1;605651;;ENST00000517395.6|NM_001378974.1;gene_ID_17
18;50943;FOXP3;forkhead box P3~Name Same As:- HGNC:13781;The protein encoded by this gene is a member of the forkhead/winged-helix family of transcriptional regulators. Defects in this gene are the cause of immunodeficiency polyendocrinopathy, enteropathy, X-linked syndrome (IPEX), also known as X-linked autoimmunity-immunodeficiency syndrome. Alternatively spliced transcript variants encoding different isoforms have been identified. [provided by RefSeq, Jul 2008];ENSG00000049768;NM_014009;Q9BZS1;300292;121913.0;ENST00000376207.10|NM_014009.4;gene_ID_18
19;65991;FUNDC2;FUN14 domain containing 2;Enables phosphatidylinositol-3,4,5-trisphosphate binding activity. Involved in intracellular triglyceride homeostasis. Located in mitochondrion. [provided by Alliance of Genome Resources, Jul 2025];ENSG00000165775;NM_023934;Q9BWH2;301042;;ENST00000369498.8|NM_023934.4;gene_ID_19
20;2543;GAGE1;G antigen 1;This gene belongs to a family of genes that are expressed in a variety of tumors but not in normal tissues, except for the testis. The sequences of the family members are highly related but differ by scattered nucleotide substitutions. The antigenic peptide YRPRPRRY, which is also encoded by several other family members, is recognized by autologous cytolytic T lymphocytes. Nothing is presently known about the function of this protein. Alternative splicing results in multiple transcript variants. [provided by RefSeq, Jun 2010];ENSG00000205777;NM_001468;P0DTW1;300594;;ENST00000381700.11|NM_001040663.4;gene_ID_20
21;102724473;GAGE10;G antigen 10;0;ENSG00000215274;NM_001098413;A6NGK3;300737;;ENST00000407599.4|NM_001098413.4;gene_ID_21
22;2703;GJA8;gap junction protein alpha 8;This gene encodes a transmembrane connexin protein that is necessary for lens growth and maturation of lens fiber cells. The encoded protein is a component of gap junction channels and functions in a calcium and pH-dependent manner. Mutations in this gene have been associated with zonular pulverulent cataracts, nuclear progressive cataracts, and cataract-microcornea syndrome. [provided by RefSeq, Dec 2009];ENSG00000121634;NM_005267;P48165;600897;122118.0;ENST00000369235.2|NM_005267.5;gene_ID_22
23;11146;GLMN;glomulin, FKBP associated protein;This gene encodes a phosphorylated protein that is a member of a Skp1-Cullin-F-box-like complex. The protein is essential for normal development of the vasculature and mutations in this gene have been associated with glomuvenous malformations, also called glomangiomas. Multiple splice variants encoding different isoforms have been found for this gene. [provided by RefSeq, Feb 2016];ENSG00000174842;NM_007070;Q92990;601749;122172.0;ENST00000370360.8|NM_053274.3;gene_ID_23
24;283767;GOLGA6L1;golgin A6 family like 1;0;ENSG00000273976;NM_001001413;Q8N7Z2;;;ENST00000614055.2|NM_001001413.3;gene_ID_24
25;8924;HERC2;HECT and RLD domain containing E3 ubiquitin protein ligase 2;This gene belongs to the HERC gene family that encodes a group of unusually large proteins, which contain multiple structural domains. All members have at least 1 copy of an N-terminal region showing homology to the cell cycle regulator RCC1 and a C-terminal HECT (homologous to E6-AP C terminus) domain found in a number of E3 ubiquitin protein ligases. Genetic variations in this gene are associated with skin/hair/eye pigmentation variability. Multiple pseudogenes of this gene are located on chromosomes 15 and 16. [provided by RefSeq, Mar 2012];ENSG00000128731;NM_004667;O95714;605837;331681.0;ENST00000261609.13|NM_004667.6;gene_ID_25
26;7290;HIRA;histone cell cycle regulator;This gene encodes a histone chaperone that preferentially places the variant histone H3.3 in nucleosomes. Orthologs of this gene in yeast, flies, and plants are necessary for the formation of transcriptionally silent heterochomatin. This gene plays an important role in the formation of the senescence-associated heterochromatin foci. These foci likely mediate the irreversible cell cycle changes that occur in senescent cells. It is considered the primary candidate gene in some haploinsufficiency syndromes such as DiGeorge syndrome, and insufficient production of the gene may disrupt normal embryonic development. [provided by RefSeq, Jul 2008];ENSG00000100084;NM_003325;P54198;600237;286557.0;ENST00000263208.5|NM_003325.4;gene_ID_26
27;3097;HIVEP2;HIVEP zinc finger 2;This gene encodes a member of a family of closely related, large, zinc finger-containing transcription factors. The encoded protein regulates transcription by binding to regulatory regions of various cellular and viral genes that maybe involved in growth, development and metastasis. The protein contains the ZAS domain comprised of two widely separated regions of zinc finger motifs, a stretch of highly acidic amino acids and a serine/threonine-rich sequence. [provided by RefSeq, Nov 2012];ENSG00000010818;NM_006734;P31629;143054;470458.0;ENST00000367603.8|NM_006734.4;gene_ID_27
28;3145;HMBS;hydroxymethylbilane synthase;This gene encodes a member of the hydroxymethylbilane synthase superfamily. The encoded protein is the third enzyme of the heme biosynthetic pathway and catalyzes the head to tail condensation of four porphobilinogen molecules into the linear hydroxymethylbilane. Mutations in this gene are associated with the autosomal dominant disease acute intermittent porphyria. Alternatively spliced transcript variants encoding different isoforms have been described. [provided by RefSeq, Jul 2008];ENSG00000256269;NM_000190;P08397;609806;122438.0;ENST00000652429.1|NM_000190.4;gene_ID_28
29;6928;HNF1B;HNF1 homeobox B;This gene encodes a member of the homeodomain-containing superfamily of transcription factors. The protein binds to DNA as either a homodimer, or a heterodimer with the related protein hepatocyte nuclear factor 1-alpha. The gene has been shown to function in nephron development, and regulates development of the embryonic pancreas. Mutations in this gene result in renal cysts and diabetes syndrome and noninsulin-dependent diabetes mellitus, and expression of this gene is altered in some types of cancer. Multiple transcript variants encoding different isoforms have been found for this gene.[provided by RefSeq, Sep 2009];ENSG00000275410;NM_000458;P35680;189907;158588.0;ENST00000617811.5|NM_000458.4;gene_ID_29
30;10075;HUWE1;HECT, UBA and WWE domain containing E3 ubiquitin protein ligase 1;This gene encodes a protein containing a C-terminal HECT (E6AP type E3 ubiquitin protein ligase) domain that functions as an E3 ubiquitin ligase. The encoded protein is required for the ubiquitination and subsequent degradation of the anti-apoptotic protein Mcl1 (myeloid cell leukemia sequence 1 (BCL2-related)). This protein also ubiquitinates the p53 tumor suppressor, core histones, and DNA polymerase beta. Mutations in this gene are associated with Turner type X-linked syndromic cognitive disability. [provided by RefSeq, Aug 2013];ENSG00000086758;NM_031407;Q7Z6Z7;300697;209314.0;ENST00000262854.11|NM_031407.7;gene_ID_30
31;284058;KANSL1;KAT8 regulatory NSL complex subunit 1;This gene encodes a nuclear protein that is a subunit of two protein complexes involved with histone acetylation, the MLL1 complex and the NSL1 complex. The encoded protein has been implicated in a variety of cellular processes including enhancer regulation, cell proliferation, and mitosis. Mutations in this gene are associated with Koolen-de Vries Syndrome. [provided by RefSeq, May 2022];ENSG00000120071;NM_015443;Q7Z3B3;612452;303739.0;ENST00000432791.7|NM_015443.4;gene_ID_31
32;7994;KAT6A;lysine acetyltransferase 6A;This gene encodes a member of the MOZ, YBFR2, SAS2, TIP60 family of histone acetyltransferases. The protein is composed of a nuclear localization domain, a double C2H2 zinc finger domain that binds to acetylated histone tails, a histone acetyl-transferase domain, a glutamate/aspartate-rich region, and a serine- and methionine-rich transactivation domain. It is part of a complex that acetylates lysine-9 residues in histone 3, and in addition, it acts as a co-activator for several transcription factors. Allelic variants of this gene are associated with an autosomal dominant form of cognitive disability. Chromosomal translocations of this gene are associated with acute myeloid leukemia. Alternative splicing results in multiple transcript variants. [provided by RefSeq, Jul 2017];ENSG00000083168;NM_006766;Q92794;601408;376575.0;ENST00000265713.8|NM_006766.5;gene_ID_32
33;547;KIF1A;kinesin family member 1A;The protein encoded by this gene is a member of the kinesin family and functions as an anterograde motor protein that transports membranous organelles along axonal microtubules. Mutations at this locus have been associated with spastic paraplegia-30 and hereditary sensory neuropathy IIC. Alternatively spliced transcript variants encoding distinct isoforms have been described. [provided by RefSeq, Apr 2012];ENSG00000130294;NM_138483;Q12756;601255;279771.0;ENST00000498729.9|NM_001244008.2;gene_ID_33
34;3835;KIF22;kinesin family member 22;The protein encoded by this gene is a member of the kinesin-like protein family. The family members are microtubule-dependent molecular motors that transport organelles within cells and move chromosomes during cell division. The C-terminal half of this protein has been shown to bind DNA. Studies with the Xenopus homolog suggests its essential role in metaphase chromosome alignment and maintenance. Alternatively spliced transcript variants encoding different isoforms have been found for this gene. [provided by RefSeq, Jan 2012];ENSG00000079616;NM_001256269;Q14807;603213;286634.0;ENST00000160827.9|NM_007317.3;gene_ID_34
35;27040;LAT;linker for activation of T cells;The protein encoded by this gene is phosphorylated by ZAP-70/Syk protein tyrosine kinases following activation of the T-cell antigen receptor (TCR) signal transduction pathway. This transmembrane protein localizes to lipid rafts and acts as a docking site for SH2 domain-containing proteins. Upon phosphorylation, this protein recruits multiple adaptor proteins and downstream signaling molecules into multimolecular signaling complexes located near the site of TCR engagement. Alternative splicing results in multiple transcript variants encoding different isoforms. [provided by RefSeq, Jul 2008];ENSG00000213658;NM_001014987;O43561;602354;;ENST00000395456.7|NM_001014987.2;gene_ID_35
36;4052;LTBP1;latent transforming growth factor beta binding protein 1;The protein encoded by this gene belongs to the family of latent TGF-beta binding proteins (LTBPs). The secretion and activation of TGF-betas is regulated by their association with latency-associated proteins and with latent TGF-beta binding proteins. The product of this gene targets latent complexes of transforming growth factor beta to the extracellular matrix, where the latent cytokine is subsequently activated by several different mechanisms. Alternatively spliced transcript variants encoding different isoforms have been identified. [provided by RefSeq, Jul 2008];ENSG00000049323;NM_206943;Q14766;150390;;ENST00000404816.7|NM_206943.4;gene_ID_36
37;8216;LZTR1;leucine zipper like post translational regulator 1;This gene encodes a member of the BTB-kelch superfamily. Initially described as a putative transcriptional regulator based on weak homology to members of the basic leucine zipper-like family, the encoded protein subsequently has been shown to localize exclusively to the Golgi network where it may help stabilize the Gogli complex. Deletion of this gene may be associated with DiGeorge syndrome. [provided by RefSeq, Jul 2008];ENSG00000099949;NM_006767;Q8N653;600574;369810.0;ENST00000646124.2|NM_006767.4;gene_ID_37
38;54551;MAGEL2;MAGE family member L2;Prader-Willi syndrome (PWS) is caused by the loss of expression of imprinted genes in chromosome 15q11-q13 region. Affected individuals exhibit neonatal hypotonia, developmental delay, and childhood-onset obesity. Necdin (NDN), a gene involved in the terminal differentiation of neurons, localizes to this region of the genome and has been implicated as one of the genes responsible for the etiology of PWS. This gene is structurally similar to NDN, is also localized to the PWS chromosomal region, and is paternally imprinted, suggesting a possible role for it in PWS. [provided by RefSeq, Oct 2010];ENSG00000254585;NM_019066;Q9UJ55;605283;123324.0;ENST00000650528.1|NM_019066.5;gene_ID_38
