;ncbi_gene_ID;HGNC;name;summary;ensembl_gene_id;refseq_accession;uniprot_ids;omim_id;orphanet;mane_select;gene_ID
74;412;STS;steroid sulfatase;This gene encodes a multi-pass membrane protein that is localized to the endoplasmic reticulum. It belongs to the sulfatase family and hydrolyzes several 3-beta-hydroxysteroid sulfates, which serve as metabolic precursors for estrogens, androgens, and cholesterol. Mutations in this gene are associated with X-linked ichthyosis (XLI). Alternatively spliced transcript variants resulting from the use of different promoters have been described for this gene (PMID:17601726). [provided by RefSeq, Mar 2016];ENSG00000101846;NM_000351;P08842;300747;119888.0;ENST00000674429.1|NM_001320752.2;gene_ID_74
75;6834;SURF1;SURF1 cytochrome c oxidase assembly factor;This gene encodes a protein localized to the inner mitochondrial membrane and thought to be involved in the biogenesis of the cytochrome c oxidase complex. The protein is a member of the SURF1 family, which includes the related yeast protein SHY1 and rickettsial protein RP733. The gene is located in the surfeit gene cluster, a group of very tightly linked genes that do not share sequence similarity, where it shares a bidirectional promoter with SURF2 on the opposite strand. Defects in this gene are a cause of Leigh syndrome, a severe neurological disorder that is commonly associated with systemic cytochrome c oxidase deficiency. [provided by RefSeq, Jul 2008];ENSG00000148290;NM_003172;Q15526;185620;119904.0;ENST00000371974.8|NM_003172.4;gene_ID_75
76;94056;SYAP1;synapse associated protein 1;"Involved in several processes, including TORC2 signaling; cellular response to epidermal growth factor stimulus; and cellular response to peptide hormone stimulus. Located in several cellular components, including Golgi apparatus; cytoplasmic side of plasma membrane; and nucleoplasm. [provided by Alliance of Genome Resources, Jul 2025]";ENSG00000169895;NM_032796;Q96A49;;;ENST00000380155.4|NM_032796.4;gene_ID_76
77;6853;SYN1;synapsin I;This gene is a member of the synapsin gene family. Synapsins encode neuronal phosphoproteins which associate with the cytoplasmic surface of synaptic vesicles. Family members are characterized by common protein domains, and they are implicated in synaptogenesis and the modulation of neurotransmitter release, suggesting a potential role in several neuropsychiatric diseases. This member of the synapsin family plays a role in regulation of axonogenesis and synaptogenesis. The protein encoded serves as a substrate for several different protein kinases and phosphorylation may function in the regulation of this protein in the nerve terminal. Mutations in this gene may be associated with X-linked disorders with primary neuronal degeneration such as Rett syndrome. Alternatively spliced transcript variants encoding different isoforms have been identified. [provided by RefSeq, Jul 2008];ENSG00000008056;NM_006950;P17600;313440;119906.0;ENST00000295987.13|NM_006950.3;gene_ID_77
78;6899;TBX1;T-box transcription factor 1;This gene is a member of a phylogenetically conserved family of genes that share a common DNA-binding domain, the T-box. T-box genes encode transcription factors involved in the regulation of developmental processes. This gene product shares 98% amino acid sequence identity with the mouse ortholog. DiGeorge syndrome (DGS)/velocardiofacial syndrome (VCFS), a common congenital disorder characterized by neural-crest-related developmental defects, has been associated with deletions of chromosome 22q11.2, where this gene has been mapped. Studies using mouse models of DiGeorge syndrome suggest a major role for this gene in the molecular etiology of DGS/VCFS. Several alternatively spliced transcript variants encoding different isoforms have been described for this gene. [provided by RefSeq, Jul 2008];ENSG00000184058;NM_080647;O43435;602054;119953.0;ENST00000649276.2|NM_001379200.1;gene_ID_78
79;645426;TMEM191C;transmembrane protein 191C;Predicted to be located in membrane. [provided by Alliance of Genome Resources, Jul 2025];ENSG00000206140;NM_001207052;A6NGB0;;;ENST00000536718.3|NM_001388354.1;gene_ID_79
80;339453;TMEM240;transmembrane protein 240;This gene encodes a transmembrane-domain containing protein found in the brain and cerebellum. Mutations in this gene result in spinocerebellar ataxia 21. [provided by RefSeq, Dec 2014];ENSG00000205090;NM_001114748;Q5SV17;616101;412653.0;ENST00000378733.9|NM_001114748.2;gene_ID_80
81;6399;TRAPPC2;trafficking protein particle complex subunit 2;The protein encoded by this gene is thought to be part of a large multi-subunit complex involved in the targeting and fusion of endoplasmic reticulum-to-Golgi transport vesicles with their acceptor compartment. In addition, the encoded protein can bind c-myc promoter-binding protein 1 and block its transcriptional repression capability. Mutations in this gene are a cause of spondyloepiphyseal dysplasia tarda (SEDT). A processed pseudogene of this gene is located on chromosome 19, and other pseudogenes are found on chromosomes 8 and Y. Alternatively spliced transcript variants have been found for this gene. [provided by RefSeq, Mar 2010];ENSG00000196459;NM_014563;P0DI81;300202;120241.0;ENST00000380579.6|NM_001011658.4;gene_ID_81
82;9319;TRIP13;thyroid hormone receptor interactor 13;This gene encodes a protein that interacts with thyroid hormone receptors, also known as hormone-dependent transcription factors. The gene product interacts specifically with the ligand binding domain. This gene is one of several that may play a role in early-stage non-small cell lung cancer. [provided by RefSeq, Oct 2009];ENSG00000071539;NM_004237;Q15645;604507;;ENST00000166345.8|NM_004237.4;gene_ID_82
83;7466;WFS1;wolframin ER transmembrane glycoprotein;This gene encodes a transmembrane protein, which is located primarily in the endoplasmic reticulum and ubiquitously expressed with highest levels in brain, pancreas, heart, and insulinoma beta-cell lines. Mutations in this gene are associated with Wolfram syndrome, also called DIDMOAD (Diabetes Insipidus, Diabetes Mellitus, Optic Atrophy, and Deafness), an autosomal recessive disorder. The disease affects the brain and central nervous system. Mutations in this gene can also cause autosomal dominant deafness 6 (DFNA6), also known as DFNA14 or DFNA38. Alternatively spliced transcript variants have been found for this gene. [provided by RefSeq, Mar 2009];ENSG00000109501;NM_001145853;O76024;606201;120514.0;ENST00000226760.5|NM_006005.3;gene_ID_83
84;8227;AKAP17A;A-kinase anchoring protein 17A;This locus encodes a protein kinase A anchoring protein. The encoded protein is part of the spliceosome complex and is involved in the regulation of alternate splicing in some mRNA precursors. Alternatively spliced transcript variants have been identified for this gene.[provided by RefSeq, Sep 2010];ENSG00000197976;NM_005088;Q02040;312095|465000;;ENST00000313871.9|NM_005088.3;gene_ID_84
85;195977;ANTXRL;ANTXR like;Predicted to enable transmembrane signaling receptor activity. Predicted to be located in membrane. Predicted to be active in cell surface and plasma membrane. [provided by Alliance of Genome Resources, Jul 2025];ENSG00000274209;NM_001278688;A6NF34;;;ENST00000620264.5|NM_001278688.3;gene_ID_85
86;200315;APOBEC3A;apolipoprotein B mRNA editing enzyme catalytic subunit 3A;This gene is a member of the cytidine deaminase gene family. It is one of seven related genes or pseudogenes found in a cluster, thought to result from gene duplication, on chromosome 22. Members of the cluster encode proteins that are structurally and functionally related to the C to U RNA-editing cytidine deaminase APOBEC1. The protein encoded by this gene lacks the zinc binding activity of other family members. The protein plays a role in immunity, by restricting transmission of foreign DNA such as viruses. One mechanism of foreign DNA restriction is deamination of foreign double-stranded DNA cytidines to uridines, which leads to DNA degradation. However, other mechanisms are also thought to be involved, as anti-viral effect is not dependent on deaminase activity. Two transcript variants encoding different isoforms have been found for this gene. [provided by RefSeq, Jul 2012];ENSG00000128383;NM_145699;P31941;607109;;ENST00000249116.7|NM_145699.4;gene_ID_86
87;9582;APOBEC3B;apolipoprotein B mRNA editing enzyme catalytic subunit 3B;This gene is a member of the cytidine deaminase gene family. It is one of seven related genes or pseudogenes found in a cluster, thought to result from gene duplication, on chromosome 22. Members of the cluster encode proteins that are structurally and functionally related to the C to U RNA-editing cytidine deaminase APOBEC1. It is thought that the proteins may be RNA editing enzymes and have roles in growth or cell cycle control. A hybrid gene results from the deletion of approximately 29.5 kb of sequence between this gene, APOBEC3B, and the adjacent gene APOBEC3A. The breakpoints of the deletion are within the two genes, so the deletion allele is predicted to have the promoter and coding region of APOBEC3A, but the 3' UTR of APOBEC3B. Two transcript variants encoding different isoforms have been found for this gene. [provided by RefSeq, Jul 2012];ENSG00000179750;NM_004900;Q9UH17;607110;;ENST00000333467.4|NM_004900.5;gene_ID_87
88;100874530;APOBEC3B-AS1;APOBEC3B antisense RNA 1;0;ENSG00000249310;NR_104187;;;;;gene_ID_88
89;414;ARSD;arylsulfatase D;The protein encoded by this gene is a member of the sulfatase family. Sulfatases are essential for the correct composition of bone and cartilage matrix. The encoded protein is postranslationally glycosylated and localized to the lysosome. This gene is located within a cluster of similar arylsulfatase genes on chromosome X. A related pseudogene has been identified in the pseudoautosomal region of chromosome Y. [provided by RefSeq, Jul 2011];ENSG00000006756;NM_001669;P51689;300002;;ENST00000381154.6|NM_001669.4;gene_ID_89
90;100506356;ARSD-AS1;ARSD antisense RNA 1;0;ENSG00000229851;NR_144459;;;;;gene_ID_90
91;416;ARSF;arylsulfatase F;This gene is a member of the sulfatase family, and more specifically, the arylsulfatase subfamily. Members of the subfamily share similarity in sequence and splice sites, and are clustered together on chromosome X, suggesting that they are derived from recent gene duplication events. Sulfatases are essential for the correct composition of bone and cartilage matrix. The activity of this protein, unlike that of arylsulfatase E, is not inhibited by warfarin. Multiple alternatively spliced variants, encoding the same protein, have been identified.[provided by RefSeq, Jan 2011];ENSG00000062096;NM_001201538;P54793;300003;;ENST00000381127.6|NM_001201539.2;gene_ID_91
92;347527;ARSH;arylsulfatase family member H;Sulfatases, such as ARSH, hydrolyze sulfate esters from sulfated steroids, carbohydrates, proteoglycans, and glycolipids. They are involved in hormone biosynthesis, modulation of cell signaling, and degradation of macromolecules (Sardiello et al., 2005 [PubMed 16174644]).[supplied by OMIM, Mar 2008];ENSG00000205667;NM_001011719;Q5FYA8;300586;;ENST00000381130.3|NM_001011719.2;gene_ID_92
93;415;ARSL;arylsulfatase L;Arylsulfatase E is a member of the sulfatase family. It is glycosylated postranslationally and localized to the golgi apparatus. Sulfatases are essential for the correct composition of bone and cartilage matrix. X-linked chondrodysplasia punctata, a disease characterized by abnormalities in cartilage and bone development, has been linked to mutations in this gene. Alternative splicing results in multiple transcript variants. A pseudogene related to this gene is located on the Y chromosome. [provided by RefSeq, Sep 2013];ENSG00000157399;NM_000047;P51690;300180;121431.0;ENST00000381134.9|NM_000047.3;gene_ID_93
94;421;ARVCF;ARVCF delta catenin family member;Armadillo Repeat gene deleted in Velo-Cardio-Facial syndrome (ARVCF) is a member of the catenin family. This family plays an important role in the formation of adherens junction complexes, which are thought to facilitate communication between the inside and outside environments of a cell. The ARVCF gene was isolated in the search for the genetic defect responsible for the autosomal dominant Velo-Cardio-Facial syndrome (VCFS), a relatively common human disorder with phenotypic features including cleft palate, conotruncal heart defects and facial dysmorphology. The ARVCF gene encodes a protein containing two motifs, a coiled coil domain in the N-terminus and a 10 armadillo repeat sequence in the midregion. Since these sequences can facilitate protein-protein interactions ARVCF is thought to function in a protein complex. In addition, ARVCF contains a predicted nuclear-targeting sequence suggesting that it may have a function as a nuclear protein. [provided by RefSeq, Jun 2010];ENSG00000099889;NM_001670;O00192;602269;121435.0;ENST00000263207.8|NM_001670.3;gene_ID_94
95;438;ASMT;acetylserotonin O-methyltransferase;This gene belongs to the methyltransferase superfamily, and is located in the pseudoautosomal region (PAR) at the end of the short arms of the X and Y chromosomes. The encoded enzyme catalyzes the final reaction in the synthesis of melatonin, and is abundant in the pineal gland. Alternatively spliced transcript variants have been noted for this gene. [provided by RefSeq, Jan 2010];ENSG00000196433;NM_004043;P46597;300015|402500;469966.0;ENST00000381241.9|NM_001171038.2;gene_ID_95
96;8623;ASMTL;acetylserotonin O-methyltransferase like;The protein encoded by this gene has an N-terminus that is similar to the multicopy associated filamentation (maf) protein of Bacillus subtilis and to orfE of Escherichia coli, while the C-terminus is similar to N-acetylserotonin O-methyltransferase. This gene is located in the pseudoautosomal region 1 (PAR1) of X and Y chromosomes. Three transcript variants encoding different isoforms have been found for this gene. [provided by RefSeq, Mar 2010];ENSG00000169093;NM_004192;O95671;300162|400011;;ENST00000381317.9|NM_004192.4;gene_ID_96
97;80161;ASMTL-AS1;ASMTL antisense RNA 1;This gene serves as the antisense to the acetylserotonin O-methyltransferase-like gene. Multiple non-coding transcript variants have been found for this gene. [provided by RefSeq, Oct 2011];ENSG00000236017;XR_040863;;;;;gene_ID_97
98;128977;C22orf39;chromosome 22 open reading frame 39;Predicted to be involved in negative regulation of long-term synaptic potentiation. Located in mitochondrion. [provided by Alliance of Genome Resources, Jul 2025];ENSG00000242259;NM_173793;Q6P5X5;;;ENST00000399562.9|NM_173793.5;gene_ID_98
99;388849;CCDC188;coiled-coil domain containing 188;Predicted to be located in membrane. [provided by Alliance of Genome Resources, Jul 2025];ENSG00000234409;NM_001365892;H7C350;;;ENST00000439765.4|NM_001365892.2;gene_ID_99
100;4267;CD99;CD99 molecule (Xg blood group);The protein encoded by this gene is a cell surface glycoprotein involved in leukocyte migration, T-cell adhesion, ganglioside GM1 and transmembrane protein transport, and T-cell death by a caspase-independent pathway. In addition, the encoded protein may have the ability to rearrange the actin cytoskeleton and may also act as an oncosuppressor in osteosarcoma. This gene is found in the pseudoautosomal region of chromosomes X and Y and escapes X-chromosome inactivation. There is a related pseudogene located immediately adjacent to this locus. [provided by RefSeq, Mar 2016];ENSG00000002586;NM_001122898;P14209;313470|450000;;ENST00000381192.10|NM_002414.5;gene_ID_100
101;8318;CDC45;cell division cycle 45;The protein encoded by this gene was identified by its strong similarity with Saccharomyces cerevisiae Cdc45, an essential protein required to the initiation of DNA replication. Cdc45 is a member of the highly conserved multiprotein complex including Cdc6/Cdc18, the minichromosome maintenance proteins (MCMs) and DNA polymerase, which is important for early steps of DNA replication in eukaryotes. This protein has been shown to interact with MCM7 and DNA polymerase alpha. Studies of the similar gene in Xenopus suggested that this protein play a pivotal role in the loading of DNA polymerase alpha onto chromatin. Alternate splicing results in multiple transcript variants. [provided by RefSeq, Jul 2013];ENSG00000093009;NM_003504;O75419;603465;461769.0;ENST00000263201.7|NM_003504.5;gene_ID_101
102;94027;CGB7;chorionic gonadotropin subunit beta 7;This gene is a member of the glycoprotein hormone beta chain family and encodes the beta 7 subunit of chorionic gonadotropin (CG). Glycoprotein hormones are heterodimers consisting of a common alpha subunit and an unique beta subunit which confers biological specificity. CG is produced by the trophoblastic cells of the placenta and stimulates the ovaries to synthesize the steroids that are essential for the maintenance of pregnancy. The beta subunit of CG is encoded by 6 genes which are arranged in tandem and inverted pairs on chromosome 19q13.3 and contiguous with the luteinizing hormone beta subunit gene. [provided by RefSeq, Jul 2008];ENSG00000196337;NM_033142;P0DN87;608826;;ENST00000684222.1|NM_001385261.1;gene_ID_102
103;100288814;CLDN34;claudin 34;Predicted to enable structural molecule activity. Predicted to be involved in bicellular tight junction assembly and cell adhesion. Predicted to be active in bicellular tight junction and plasma membrane. [provided by Alliance of Genome Resources, Apr 2025];ENSG00000234469;NM_001195081;H7C241;;;ENST00000445307.4|NM_001195081.2;gene_ID_103
104;7122;CLDN5;claudin 5;This gene encodes a member of the claudin family. Claudins are integral membrane proteins and components of tight junction strands. Tight junction strands serve as a physical barrier to prevent solutes and water from passing freely through the paracellular space between epithelial or endothelial cell sheets. Mutations in this gene have been found in patients with velocardiofacial syndrome. Alternative splicing results in multiple transcript variants encoding distinct isoforms. [provided by RefSeq, May 2018];ENSG00000184113;NM_003277;O00501;602101;;ENST00000618236.2|NM_001363066.2;gene_ID_104
105;8218;CLTCL1;clathrin heavy chain like 1;This gene is a member of the clathrin heavy chain family and encodes a major protein of the polyhedral coat of coated pits and vesicles. Chromosomal aberrations involving this gene are associated with meningioma, DiGeorge syndrome, and velo-cardio-facial syndrome. Multiple transcript variants encoding different isoforms have been found for this gene. [provided by RefSeq, Jun 2009];ENSG00000070371;NM_007098;P53675;601273;457570.0;ENST00000427926.6|NM_007098.4;gene_ID_105
106;1312;COMT;catechol-O-methyltransferase;Catechol-O-methyltransferase catalyzes the transfer of a methyl group from S-adenosylmethionine to catecholamines, including the neurotransmitters dopamine, epinephrine, and norepinephrine. This O-methylation results in one of the major degradative pathways of the catecholamine transmitters. In addition to its role in the metabolism of endogenous substances, COMT is important in the metabolism of catechol drugs used in the treatment of hypertension, asthma, and Parkinson disease. COMT is found in two forms in tissues, a soluble form (S-COMT) and a membrane-bound form (MB-COMT). The differences between S-COMT and MB-COMT reside within the N-termini. Several transcript variants are formed through the use of alternative translation initiation sites and promoters. [provided by RefSeq, Sep 2008];ENSG00000093010;NM_000754;P21964;116790;241992.0;ENST00000361682.11|NM_000754.4;gene_ID_106
107;1438;CSF2RA;colony stimulating factor 2 receptor subunit alpha;The protein encoded by this gene is the alpha subunit of the heterodimeric receptor for colony stimulating factor 2, a cytokine which controls the production, differentiation, and function of granulocytes and macrophages. The encoded protein is a member of the cytokine family of receptors. This gene is found in the pseudoautosomal region (PAR) of the X and Y chromosomes. Multiple transcript variants encoding different isoforms have been found for this gene, with some of the isoforms being membrane-bound and others being soluble. [provided by RefSeq, Jul 2008];ENSG00000198223;NM_001161529;P15509;306250|425000;209477.0;ENST00000381529.9|NM_172245.4;gene_ID_107
108;25786;DGCR11;DiGeorge syndrome critical region gene 11;0;ENSG00000273311;NR_024157;;;;;gene_ID_108
109;9993;DGCR2;DiGeorge syndrome critical region gene 2;Deletions of the 22q11.2 have been associated with a wide range of developmental defects (notably DiGeorge syndrome, velocardiofacial syndrome, conotruncal anomaly face syndrome and isolated conotruncal cardiac defects) classified under the acronym CATCH 22. The DGCR2 gene encodes a novel putative adhesion receptor protein, which could play a role in neural crest cells migration, a process which has been proposed to be altered in DiGeorge syndrome. Alternative splicing results in multiple transcript variants.[provided by RefSeq, May 2010];ENSG00000070413;NM_005137;P98153;600594;;ENST00000263196.12|NM_005137.3;gene_ID_109
110;54487;DGCR8;DGCR8 microprocessor complex subunit;This gene encodes a subunit of the microprocessor complex which mediates the biogenesis of microRNAs from the primary microRNA transcript. The encoded protein is a double-stranded RNA binding protein that functions as the non-catalytic subunit of the microprocessor complex. This protein is required for binding the double-stranded RNA substrate and facilitates cleavage of the RNA by the ribonuclease III protein, Drosha. Alternate splicing results in multiple transcript variants. [provided by RefSeq, Jun 2010];ENSG00000128191;NM_001190326;Q8WYQ5;609030;;ENST00000351989.8|NM_022720.7;gene_ID_110
111;317749;DHRS4L2;dehydrogenase/reductase 4 like 2;This gene encodes a member of the short chain dehydrogenase reductase family. The encoded protein may be an NADPH dependent retinol oxidoreductase. Alternate splicing results in multiple transcript variants. [provided by RefSeq, Aug 2010];ENSG00000187630;NM_001193635;Q6PKH6;615196;;ENST00000335125.11|NM_198083.4;gene_ID_111
112;207063;DHRSX;dehydrogenase/reductase X-linked;Enables dolichal reductase [NAD(P)+] activity and polyprenol dehydrogenase activity. Involved in dolichol biosynthetic process and positive regulation of autophagy. Located in extracellular region. Is active in lipid droplet. [provided by Alliance of Genome Resources, Apr 2025];ENSG00000169084;NM_145177;Q8N5I4;301034;;ENST00000334651.11|NM_145177.3;gene_ID_112
113;8220;ESS2;ess-2 spliceosome associated protein;This gene is located within the minimal DGS critical region (MDGCR) thought to contain the gene(s) responsible for a group of developmental disorders. These disorders include DiGeorge syndrome, velocardiofacial syndrome, conotruncal anomaly face syndrome, and some familial or sporadic conotruncal cardiac defects which have been associated with microdeletion of 22q11.2. The encoded protein may be a component of C complex spliceosomes, and the orthologous protein in the mouse localizes to the nucleus. Alternatively spliced transcript variants have been found for this gene. [provided by RefSeq, Dec 2015];ENSG00000100056;NM_022719;Q96DF8;601755;;ENST00000252137.11|NM_022719.3;gene_ID_113
114;348487;FAM131C;family with sequence similarity 131 member C;0;ENSG00000185519;NM_182623;Q96AQ9;;;ENST00000375662.5|NM_182623.3;gene_ID_114
115;101927859;FAM230G;family with sequence similarity 230 member G;0;ENSG00000188280;NR_136572;;;;;gene_ID_115
116;101930105;FAM239A;family with sequence similarity 239 member A;0;ENSG00000234449;NR_146580;;;;;gene_ID_116
117;729162;FAM239B;family with sequence similarity 239 member B;0;ENSG00000205663;NR_146578;;;;;gene_ID_117
118;107987330;FAM239C;family with sequence similarity 239 member C;0;ENSG00000205662;XR_001755780;;;;;gene_ID_118
119;100132923;FAM66D;family with sequence similarity 66 member D;0;ENSG00000255052;NR_027425;;;;;gene_ID_119
120;619423;FAM85A;family with sequence similarity 85 member A;0;;NR_146925;;;;;gene_ID_120
121;2358;FPR2;formyl peptide receptor 2;"Enables amyloid-beta binding activity; scavenger receptor binding activity; and signaling receptor activity. Involved in several processes, including cellular response to amyloid-beta; positive regulation of ERK1 and ERK2 cascade; and regulation of defense response. Located in cytoplasm and plasma membrane. [provided by Alliance of Genome Resources, Jul 2025]";ENSG00000171049;NM_001005738;P25090;136538;;ENST00000340023.7|NM_001005738.2;gene_ID_121
122;2359;FPR3;formyl peptide receptor 3;"Predicted to enable N-formyl peptide receptor activity and complement receptor activity. Predicted to be involved in several processes, including complement receptor mediated signaling pathway; phospholipase C-activating G protein-coupled receptor signaling pathway; and positive regulation of cytosolic calcium ion concentration. Predicted to act upstream of or within G protein-coupled receptor signaling pathway. Predicted to be located in membrane. Predicted to be active in plasma membrane. [provided by Alliance of Genome Resources, Jul 2025]";ENSG00000187474;NM_002030;P25089;136539;;ENST00000339223.5|NM_002030.5;gene_ID_122
